{
  "$schema": "https://json-schema.org/draft/2020-12/schema",
  "$id": "https://raw.githubusercontent.com/DankerMu/my-agents/main/schemas/agent.schema.json",
  "title": "Agent Metadata",
  "type": "object",
  "additionalProperties": false,
  "required": [
    "schemaVersion",
    "name",
    "displayName",
    "description",
    "version",
    "maturity",
    "categories",
    "authors",
    "archetype"
  ],
  "properties": {
    "schemaVersion": {
      "type": "integer",
      "const": 1
    },
    "name": {
      "type": "string",
      "pattern": "^[a-z0-9]+(?:-[a-z0-9]+)*$",
      "description": "Agent 唯一标识（与目录名一致），kebab-case。"
    },
    "displayName": {
      "type": "string",
      "minLength": 1,
      "description": "对外展示名称（可含空格/大小写）。"
    },
    "description": {
      "type": "string",
      "minLength": 1,
      "description": "一句话描述，用于索引与搜索。"
    },
    "version": {
      "type": "string",
      "pattern": "^\\d+\\.\\d+\\.\\d+(?:-[0-9A-Za-z.-]+)?(?:\\+[0-9A-Za-z.-]+)?$",
      "description": "SemVer。"
    },
    "maturity": {
      "type": "string",
      "enum": ["experimental", "beta", "stable", "deprecated"]
    },
    "categories": {
      "type": "array",
      "minItems": 1,
      "items": {
        "type": "string",
        "pattern": "^[a-z0-9]+(?:-[a-z0-9]+)*$"
      },
      "description": "分类（小写 kebab-case），需在 categories.json 白名单中。"
    },
    "tags": {
      "type": "array",
      "items": {
        "type": "string"
      }
    },
    "authors": {
      "type": "array",
      "minItems": 1,
      "items": {
        "$ref": "#/$defs/person"
      }
    },
    "contributors": {
      "type": "array",
      "items": {
        "$ref": "#/$defs/person"
      }
    },
    "maintainers": {
      "type": "array",
      "items": {
        "$ref": "#/$defs/person"
      },
      "description": "维护者（可不同于 authors）。"
    },
    "archetype": {
      "type": "string",
      "enum": ["explorer", "reviewer", "implementer", "planner", "debugger", "custom"],
      "description": "Agent 原型，用于分类和索引。"
    },
    "skills": {
      "type": "array",
      "items": {
        "type": "string",
        "pattern": "^[a-z0-9]+(?:-[a-z0-9]+)*$"
      },
      "description": "依赖的 skill 名称列表（引用 skills/<name>）。"
    },
    "agents": {
      "type": "array",
      "items": {
        "type": "string",
        "pattern": "^[a-z0-9]+(?:-[a-z0-9]+)*$"
      },
      "description": "Canonical agent dependency graph（引用 agents/<name>）。如果某个平台的运行时投影需要更扁平或不同的依赖面，请使用 platformDependencies。"
    },
    "platformDependencies": {
      "type": "object",
      "additionalProperties": false,
      "properties": {
        "claude-code": {
          "$ref": "#/$defs/platformAgentDependencies"
        },
        "codex": {
          "$ref": "#/$defs/platformAgentDependencies"
        }
      },
      "description": "可选的平台专用依赖覆盖。用于表达某个平台的直接子 agent 面与 canonical agent graph 不同的情况。"
    },
    "license": {
      "type": "string",
      "description": "可选：SPDX 标识或简短描述；为空表示继承仓库 License。"
    },
    "links": {
      "type": "object",
      "additionalProperties": false,
      "properties": {
        "homepage": { "type": "string", "format": "uri" },
        "repository": { "type": "string", "format": "uri" },
        "issues": { "type": "string", "format": "uri" },
        "docs": { "type": "string", "format": "uri" }
      }
    },
    "entrypoints": {
      "type": "object",
      "additionalProperties": false,
      "properties": {
        "contract": { "type": "string", "default": "AGENT.md" },
        "changelog": { "type": "string", "default": "CHANGELOG.md" }
      }
    },
    "requirements": {
      "type": "object",
      "additionalProperties": false,
      "properties": {
        "os": {
          "type": "array",
          "items": {
            "type": "string",
            "enum": ["macos", "linux", "windows"]
          }
        },
        "runtimes": {
          "type": "object",
          "additionalProperties": false,
          "properties": {
            "node": { "type": "string" },
            "python": { "type": "string" }
          }
        },
        "tools": {
          "type": "array",
          "items": { "type": "string" }
        },
        "network": {
          "type": "string",
          "enum": ["none", "optional", "required"]
        }
      }
    },
    "capabilities": {
      "type": "object",
      "additionalProperties": false,
      "properties": {
        "shell": { "type": "boolean" },
        "network": { "type": "boolean" },
        "filesystemRead": { "type": "boolean" },
        "filesystemWrite": { "type": "boolean" }
      },
      "description": "Agent 可能触达的资源范围（非强制）。"
    },
    "deprecated": {
      "type": "boolean"
    },
    "replacedBy": {
      "type": "string",
      "pattern": "^[a-z0-9]+(?:-[a-z0-9]+)*$"
    }
  },
  "$defs": {
    "person": {
      "type": "object",
      "additionalProperties": false,
      "required": ["name"],
      "properties": {
        "name": { "type": "string", "minLength": 1 },
        "email": { "type": "string", "format": "email" },
        "url": { "type": "string", "format": "uri" }
      }
    },
    "platformAgentDependencies": {
      "type": "object",
      "additionalProperties": false,
      "properties": {
        "agents": {
          "type": "array",
          "items": {
            "type": "string",
            "pattern": "^[a-z0-9]+(?:-[a-z0-9]+)*$"
          },
          "description": "平台运行时投影下可直接使用的 agent 名称列表。"
        }
      }
    }
  }
}
