{
  "schemaVersion": 1,
  "name": "triager",
  "displayName": "Triager",
  "description": "Issue triage agent that reads an issue, assesses actionability, decides routing (execute/split/plan/investigate/defer/reject/escalate), and writes an execution brief for workers.",
  "version": "0.1.2",
  "maturity": "experimental",
  "categories": ["workflow"],
  "tags": ["triage", "issue", "routing", "brief", "issue-agent-os"],
  "authors": [
    {
      "name": "Qiongyu Li"
    }
  ],
  "archetype": "custom",
  "capabilities": {
    "shell": true,
    "network": false,
    "filesystemRead": true,
    "filesystemWrite": false
  }
}
