{
  "schemaVersion": 1,
  "name": "issue-scout",
  "displayName": "Issue Scout",
  "description": "Given a GitHub issue or bug description, search the codebase for relevant files, symbols, and context to scope the change surface before implementation.",
  "version": "0.1.1",
  "maturity": "experimental",
  "categories": ["coding", "productivity"],
  "tags": ["issue", "context", "search", "read-only"],
  "authors": [{ "name": "Qiongyu Li" }],
  "archetype": "explorer",
  "skills": [],
  "capabilities": {
    "shell": true,
    "network": false,
    "filesystemRead": true,
    "filesystemWrite": false
  }
}
