{
  "schemaVersion": 1,
  "name": "debugger",
  "displayName": "Debugger",
  "description": "Systematic debugging agent that diagnoses bugs, test failures, and unexpected behavior through hypothesis-driven investigation.",
  "version": "1.0.6",
  "maturity": "experimental",
  "categories": ["debugging", "coding"],
  "tags": ["debugging", "troubleshooting", "bug-fix", "diagnostics"],
  "authors": [
    {
      "name": "Qiongyu Li"
    }
  ],
  "archetype": "debugger",
  "skills": ["clarify"],
  "agents": ["explorer"],
  "capabilities": {
    "shell": true,
    "network": false,
    "filesystemRead": true,
    "filesystemWrite": true
  },
  "entrypoints": {
    "contract": "AGENT.md"
  }
}
