{
  "schemaVersion": 1,
  "name": "verifier",
  "displayName": "Verifier",
  "description": "Independent finding-verification agent. Adjudicates one failure-class batch of candidate review findings (at most 5) with exactly one verdict per candidate — CONFIRMED, PLAUSIBLE, or REFUTED — using only diff/spec/code/test evidence. Read-only; never a reviewer that produced any candidate in its batch.",
  "version": "0.7.3",
  "maturity": "experimental",
  "categories": ["review", "coding"],
  "tags": ["verification", "code-review", "finding-gate"],
  "authors": [
    {
      "name": "danker"
    }
  ],
  "archetype": "custom",
  "capabilities": {
    "shell": true,
    "network": false,
    "filesystemRead": true,
    "filesystemWrite": false
  },
  "entrypoints": {
    "contract": "AGENT.md"
  }
}
