{
  "schemaVersion": 1,
  "name": "explorer",
  "displayName": "Explorer",
  "description": "Use when a task needs fast read-only codebase mapping, evidence gathering, impact analysis, or file and symbol discovery before implementation or review.",
  "version": "1.5.3",
  "maturity": "experimental",
  "categories": ["coding", "productivity"],
  "tags": ["exploration", "search", "read-only"],
  "authors": [
    {
      "name": "Qiongyu Li"
    }
  ],
  "archetype": "explorer",
  "capabilities": {
    "shell": true,
    "network": false,
    "filesystemRead": true,
    "filesystemWrite": false
  },
  "entrypoints": {
    "contract": "AGENT.md"
  }
}
