{
  "schemaVersion": 1,
  "name": "coder",
  "displayName": "Coder",
  "description": "Issue Agent OS coding worker. Implements features, fixes, refactors, and docs changes in an isolated worktree based on a triager-written brief.",
  "version": "0.1.4",
  "maturity": "experimental",
  "categories": ["coding"],
  "tags": ["implementation", "coding", "worker", "issue-agent-os"],
  "authors": [
    {
      "name": "Qiongyu Li"
    }
  ],
  "archetype": "implementer",
  "capabilities": {
    "shell": true,
    "network": false,
    "filesystemRead": true,
    "filesystemWrite": true
  },
  "entrypoints": {
    "contract": "AGENT.md"
  }
}
