{
  "schemaVersion": 1,
  "name": "issue-solver",
  "displayName": "Issue Solver",
  "description": "Solves a single GitHub issue end-to-end by orchestrating specialist agents through triage, implementation, review, and merge.",
  "version": "0.2.6",
  "maturity": "experimental",
  "categories": ["workflow", "coding"],
  "tags": ["issue", "orchestration", "github", "codex", "issue-agent-os"],
  "authors": [
    {
      "name": "Qiongyu Li"
    }
  ],
  "archetype": "custom",
  "agents": ["triager", "planner", "coder", "reviewer", "debugger", "splitter"],
  "capabilities": {
    "shell": true,
    "network": true,
    "filesystemRead": true,
    "filesystemWrite": true
  },
  "entrypoints": {
    "contract": "AGENT.md"
  }
}
