{
  "schemaVersion": 1,
  "name": "planner",
  "displayName": "Planner",
  "description": "Architecture and implementation planning agent that designs step-by-step plans with trade-off analysis and escalates to implementation-planning for complex technical execution plans.",
  "version": "1.4.2",
  "maturity": "experimental",
  "categories": ["design", "coding", "productivity"],
  "tags": ["architecture", "planning", "design"],
  "authors": [
    {
      "name": "Qiongyu Li"
    }
  ],
  "archetype": "planner",
  "skills": ["brainstorming", "clarify", "implementation-planning"],
  "agents": ["explorer", "researcher"],
  "capabilities": {
    "shell": true,
    "network": true,
    "filesystemRead": true,
    "filesystemWrite": false
  },
  "entrypoints": {
    "contract": "AGENT.md"
  }
}
