{
  "schemaVersion": 1,
  "name": "reviewer",
  "displayName": "Reviewer",
  "description": "Code review agent that performs structured, severity-graded reviews on PRs, diffs, and code changes.",
  "version": "2.6.4",
  "maturity": "experimental",
  "categories": ["review", "coding"],
  "tags": ["code-review", "pr", "security"],
  "authors": [
    {
      "name": "Qiongyu Li"
    }
  ],
  "archetype": "reviewer",
  "agents": ["explorer"],
  "capabilities": {
    "shell": true,
    "network": false,
    "filesystemRead": true,
    "filesystemWrite": false
  },
  "entrypoints": {
    "contract": "AGENT.md"
  }
}
