{
  "schemaVersion": 1,
  "name": "researcher",
  "displayName": "Researcher",
  "description": "Web research agent for deep investigation, multi-source verification, and structured report generation.",
  "version": "1.3.2",
  "maturity": "experimental",
  "categories": ["research", "productivity"],
  "tags": ["research", "web", "citations"],
  "authors": [
    {
      "name": "Qiongyu Li"
    }
  ],
  "archetype": "explorer",
  "skills": ["deep-research"],
  "capabilities": {
    "shell": false,
    "network": true,
    "filesystemRead": true,
    "filesystemWrite": false
  },
  "requirements": {
    "network": "required"
  },
  "entrypoints": {
    "contract": "AGENT.md"
  }
}
