{
  "schemaVersion": 1,
  "name": "monitor",
  "displayName": "Monitor",
  "description": "Cheap-model watchdog for harness-external long-running jobs (slurm, remote PID over ssh, CI runs). ID-based completion detection, one blocking poll loop per check, quiet waits, final-state report with evidence. Read-only; never does side work.",
  "version": "0.3.3",
  "maturity": "experimental",
  "categories": ["devops", "workflow"],
  "tags": ["monitoring", "long-running", "slurm", "ci", "keepalive"],
  "authors": [
    {
      "name": "danker"
    }
  ],
  "archetype": "custom",
  "capabilities": {
    "shell": true,
    "network": true,
    "filesystemRead": true,
    "filesystemWrite": false
  },
  "requirements": {
    "tools": ["bash"],
    "network": "optional"
  },
  "entrypoints": {
    "contract": "AGENT.md"
  }
}
